{
  "schemaVersion": 1,
  "id": "zx-spectrum",
  "kind": "emulated",
  "name": "Sinclair ZX Spectrum",
  "shortName": "ZX Spectrum",
  "iconKey": "input-gaming",
  "artworkAsset": "../assets/retroarch.svg",
  "systems": [
    "zxspectrum",
    "zx-spectrum"
  ],
  "capabilities": [
    {
      "id": "overview",
      "label": "Visão geral",
      "state": "planned",
      "detail": "Biblioteca ZX Spectrum composta pelo scanner declarativo.",
      "action": null
    },
    {
      "id": "graphics",
      "label": "Vídeo e timing",
      "state": "planned",
      "detail": "Modelo, região e bordas permanecem configuráveis no RetroArch.",
      "action": null
    },
    {
      "id": "controls",
      "label": "Controles",
      "state": "ready",
      "detail": "Gamepad base com teclado e joysticks históricos declarados.",
      "action": {
        "id": "controls.profile.activate",
        "label": "Selecionar perfil",
        "requiresConfirmation": true
      }
    },
    {
      "id": "media",
      "label": "Mídia",
      "state": "planned",
      "detail": "Snapshots, fitas e discos são reconhecidos pelo scanner declarativo.",
      "action": null
    }
  ],
  "areas": [
    {
      "id": "overview",
      "label": "Visão geral",
      "iconKey": "dashboard",
      "capabilityId": "overview"
    },
    {
      "id": "graphicsPerformance",
      "label": "Vídeo e timing",
      "iconKey": "video-display",
      "capabilityId": "graphics"
    },
    {
      "id": "controls",
      "label": "Controles",
      "iconKey": "gamepad",
      "capabilityId": "controls"
    },
    {
      "id": "media",
      "label": "Mídia",
      "iconKey": "image",
      "capabilityId": "media"
    }
  ],
  "emulators": [
    {
      "id": "retroarch",
      "name": "RetroArch",
      "adapterId": "retroarch",
      "precedence": 1,
      "role": "multi-system",
      "launch": {
        "core": "fuse",
        "openArgs": [],
        "gameArgs": [
          "-L",
          "{core}",
          "{rom}"
        ]
      }
    }
  ],
  "media": {
    "extensions": [
      "dsk",
      "gz",
      "img",
      "mgt",
      "rzx",
      "scl",
      "sna",
      "szx",
      "tap",
      "trd",
      "tzx",
      "udi",
      "z80",
      "7z",
      "zip"
    ],
    "artworkKinds": [
      "cover",
      "background",
      "logo",
      "icon"
    ],
    "providers": [
      "screenscraper",
      "steamgriddb"
    ]
  },
  "controls": {
    "profiles": [
      "retroarch-classic-gamepad"
    ],
    "maxPlayers": 2,
    "specialized": [
      "keyboard",
      "joystick"
    ]
  },
  "timing": {
    "standards": [
      "pal"
    ],
    "defaultStandard": "pal",
    "unknownFallback": "unknown-explicit"
  },
  "presets": [
    {
      "id": "como-era",
      "label": "Como era",
      "state": "planned",
      "detail": "Modelo e saída histórica."
    },
    {
      "id": "equilibrado",
      "label": "Equilibrado",
      "state": "planned",
      "detail": "Nitidez sem alterar timing."
    },
    {
      "id": "melhorado",
      "label": "Melhorado",
      "state": "planned",
      "detail": "Aprimoramentos opt-in."
    }
  ],
  "cloud": null
}
