{
  "schemaVersion": 1,
  "id": "virtual-boy",
  "kind": "emulated",
  "name": "Nintendo Virtual Boy",
  "shortName": "Virtual Boy",
  "iconKey": "input-gaming",
  "artworkAsset": "../assets/retroarch.svg",
  "systems": [
    "virtualboy",
    "virtual-boy"
  ],
  "capabilities": [
    {
      "id": "overview",
      "label": "Visão geral",
      "state": "planned",
      "detail": "Biblioteca Virtual Boy composta pelo scanner declarativo.",
      "action": null
    },
    {
      "id": "graphics",
      "label": "Vídeo e timing",
      "state": "planned",
      "detail": "Profundidade, paleta e modo de exibição permanecem configuráveis no RetroArch.",
      "action": null
    },
    {
      "id": "controls",
      "label": "Controles",
      "state": "ready",
      "detail": "Perfil base reversível com dois direcionais declarados.",
      "action": {
        "id": "controls.profile.activate",
        "label": "Selecionar perfil",
        "requiresConfirmation": true
      }
    },
    {
      "id": "media",
      "label": "Mídia",
      "state": "planned",
      "detail": "Artwork será composto pelos provedores declarados.",
      "action": null
    }
  ],
  "areas": [
    {
      "id": "overview",
      "label": "Visão geral",
      "iconKey": "dashboard",
      "capabilityId": "overview"
    },
    {
      "id": "graphicsPerformance",
      "label": "Vídeo e timing",
      "iconKey": "video-display",
      "capabilityId": "graphics"
    },
    {
      "id": "controls",
      "label": "Controles",
      "iconKey": "gamepad",
      "capabilityId": "controls"
    },
    {
      "id": "media",
      "label": "Mídia",
      "iconKey": "image",
      "capabilityId": "media"
    }
  ],
  "emulators": [
    {
      "id": "retroarch",
      "name": "RetroArch",
      "adapterId": "retroarch",
      "precedence": 1,
      "role": "multi-system",
      "launch": {
        "core": "mednafen_vb",
        "openArgs": [],
        "gameArgs": [
          "-L",
          "{core}",
          "{rom}"
        ]
      }
    }
  ],
  "media": {
    "extensions": [
      "bin",
      "vb",
      "vboy",
      "7z",
      "zip"
    ],
    "artworkKinds": [
      "cover",
      "background",
      "logo",
      "icon"
    ],
    "providers": [
      "screenscraper",
      "steamgriddb"
    ],
    "nature": "cartridge",
    "formats": {
      "vb": [
        "vb",
        "vboy",
        "bin"
      ]
    },
    "containerPolicy": "native",
    "auxiliaryContent": "none"
  },
  "controls": {
    "profiles": [
      "retroarch-classic-gamepad"
    ],
    "maxPlayers": 1,
    "specialized": [
      "dual-d-pad"
    ]
  },
  "timing": {
    "standards": [
      "ntsc"
    ],
    "defaultStandard": "ntsc",
    "unknownFallback": "unknown-explicit"
  },
  "presets": [
    {
      "id": "como-era",
      "label": "Como era",
      "state": "planned",
      "detail": "Paleta e profundidade históricas."
    },
    {
      "id": "equilibrado",
      "label": "Equilibrado",
      "state": "planned",
      "detail": "Conforto visual sem alterar timing."
    },
    {
      "id": "melhorado",
      "label": "Melhorado",
      "state": "planned",
      "detail": "Aprimoramentos opt-in."
    }
  ],
  "cloud": null
}
