{
  "schemaVersion": 1,
  "id": "colecovision",
  "kind": "emulated",
  "name": "ColecoVision",
  "shortName": "ColecoVision",
  "iconKey": "input-gaming",
  "artworkAsset": "../assets/retroarch.svg",
  "systems": [
    "colecovision"
  ],
  "capabilities": [
    {
      "id": "overview",
      "label": "Visão geral",
      "state": "planned",
      "detail": "Biblioteca ColecoVision composta pelo scanner declarativo.",
      "action": null
    },
    {
      "id": "graphics",
      "label": "Vídeo e timing",
      "state": "planned",
      "detail": "Região e saída histórica permanecem configuráveis no RetroArch.",
      "action": null
    },
    {
      "id": "controls",
      "label": "Controles",
      "state": "ready",
      "detail": "Gamepad base com teclado numérico e Roller Controller declarados.",
      "action": {
        "id": "controls.profile.activate",
        "label": "Selecionar perfil",
        "requiresConfirmation": true
      }
    },
    {
      "id": "media",
      "label": "Mídia",
      "state": "planned",
      "detail": "Cartuchos, fitas e discos são declarados sem presumir plataforma por formato compartilhado.",
      "action": null
    }
  ],
  "areas": [
    {
      "id": "overview",
      "label": "Visão geral",
      "iconKey": "dashboard",
      "capabilityId": "overview"
    },
    {
      "id": "graphicsPerformance",
      "label": "Vídeo e timing",
      "iconKey": "video-display",
      "capabilityId": "graphics"
    },
    {
      "id": "controls",
      "label": "Controles",
      "iconKey": "gamepad",
      "capabilityId": "controls"
    },
    {
      "id": "media",
      "label": "Mídia",
      "iconKey": "image",
      "capabilityId": "media"
    }
  ],
  "emulators": [
    {
      "id": "retroarch",
      "name": "RetroArch",
      "adapterId": "retroarch",
      "precedence": 1,
      "role": "multi-system",
      "launch": {
        "core": "bluemsx",
        "openArgs": [],
        "gameArgs": [
          "-L",
          "{core}",
          "{rom}"
        ]
      }
    }
  ],
  "media": {
    "extensions": [
      "bin",
      "cas",
      "col",
      "cv",
      "dsk",
      "m3u",
      "mx1",
      "mx2",
      "myv",
      "ri",
      "rom",
      "sc",
      "sg",
      "7z",
      "zip"
    ],
    "artworkKinds": [
      "cover",
      "background",
      "logo",
      "icon"
    ],
    "providers": [
      "screenscraper",
      "steamgriddb"
    ]
  },
  "controls": {
    "profiles": [
      "retroarch-classic-gamepad"
    ],
    "maxPlayers": 2,
    "specialized": [
      "keypad",
      "roller-controller"
    ]
  },
  "timing": {
    "standards": [
      "ntsc",
      "pal"
    ],
    "defaultStandard": null,
    "unknownFallback": "unknown-explicit"
  },
  "presets": [
    {
      "id": "como-era",
      "label": "Como era",
      "state": "planned",
      "detail": "Saída histórica por região."
    },
    {
      "id": "equilibrado",
      "label": "Equilibrado",
      "state": "planned",
      "detail": "Nitidez sem alterar timing."
    },
    {
      "id": "melhorado",
      "label": "Melhorado",
      "state": "planned",
      "detail": "Aprimoramentos opt-in."
    }
  ],
  "cloud": null
}
