{
  "schemaVersion": 1,
  "id": "commodore-64",
  "kind": "emulated",
  "name": "Commodore 64",
  "shortName": "C64",
  "iconKey": "input-gaming",
  "artworkAsset": "../assets/retroarch.svg",
  "systems": ["c64", "commodore64"],
  "capabilities": [
    {"id": "overview", "label": "Visão geral", "state": "planned", "detail": "Biblioteca Commodore 64 composta pelo scanner declarativo.", "action": null},
    {"id": "graphics", "label": "Vídeo e timing", "state": "planned", "detail": "Modelo, região e saída de vídeo permanecem configuráveis no RetroArch.", "action": null},
    {"id": "controls", "label": "Controles", "state": "ready", "detail": "Gamepad base com teclado, joystick e mouse declarados.", "action": {"id": "controls.profile.activate", "label": "Selecionar perfil", "requiresConfirmation": true}},
    {"id": "media", "label": "Mídia", "state": "planned", "detail": "Cartuchos, fitas, discos e snapshots são reconhecidos pelo scanner declarativo.", "action": null}
  ],
  "areas": [
    {"id": "overview", "label": "Visão geral", "iconKey": "dashboard", "capabilityId": "overview"},
    {"id": "graphicsPerformance", "label": "Vídeo e timing", "iconKey": "video-display", "capabilityId": "graphics"},
    {"id": "controls", "label": "Controles", "iconKey": "gamepad", "capabilityId": "controls"},
    {"id": "media", "label": "Mídia", "iconKey": "image", "capabilityId": "media"}
  ],
  "emulators": [{"id": "retroarch", "name": "RetroArch", "adapterId": "retroarch", "precedence": 1, "role": "multi-system"}],
  "media": {"extensions": ["bin", "cmd", "crt", "d2m", "d4m", "d64", "d6z", "d71", "d7z", "d80", "d81", "d82", "d8z", "g41", "g4z", "g64", "g6z", "gz", "lnx", "m3u", "nbz", "nib", "p00", "prg", "t64", "tap", "vfl", "vsf", "x64", "x6z", "7z", "zip"], "artworkKinds": ["cover", "background", "logo", "icon"], "providers": ["screenscraper", "steamgriddb"]},
  "controls": {"profiles": ["retroarch-classic-gamepad"], "maxPlayers": 2, "specialized": ["keyboard", "joystick", "mouse"]},
  "timing": {"standards": ["ntsc", "pal"], "defaultStandard": null, "unknownFallback": "unknown-explicit"},
  "presets": [
    {"id": "como-era", "label": "Como era", "state": "planned", "detail": "Modelo e saída histórica por região."},
    {"id": "equilibrado", "label": "Equilibrado", "state": "planned", "detail": "Nitidez sem alterar timing."},
    {"id": "melhorado", "label": "Melhorado", "state": "planned", "detail": "Aprimoramentos opt-in."}
  ],
  "cloud": null
}
